{
  "schemaVersion": 3,
  "extVersion": "0.1.0",
  "canvas": {
    "cssWidth": 1214,
    "cssHeight": 607,
    "width": 2428,
    "height": 1214
  },
  "render": {
    "displayMissRate": null,
    "copyMsP50": null,
    "videoDropped": 0,
    "videoTotal": 30,
    "loopFps": null,
    "path": null,
    "copyMsP95": null,
    "mode": "identity",
    "jsP50": null,
    "copySkipped": 0,
    "frames": 0,
    "jsP95": null,
    "displayHz": null
  },
  "frameProbe": {
    "copySyncMs": 0,
    "copyErr": null,
    "c2d": 138.52,
    "c2dSyncMs": 27,
    "c2dErr": null,
    "extSyncMs": 1,
    "at": 1437,
    "extErr": null,
    "ext": 0,
    "ms": 39,
    "copy": 0,
    "n": 1
  },
  "flags": {
    "fullscreen": false,
    "drm": false,
    "attached": false,
    "blackFrame": true
  },
  "errors": [
    {
      "at": "blackFrame",
      "name": "BlackFrame",
      "message": "selected path (none) output ≈0 while c2d/copy>0"
    }
  ],
  "milestone": "M2",
  "page": {
    "url": "/watch?v=MR_53SGVXXc"
  },
  "env": {
    "dpr": 2,
    "screen": {
      "w": 1800,
      "h": 1169
    },
    "dynamicRangeHigh": true,
    "colorGamutP3": true,
    "ua": "Mozilla/5.0 (Macintosh; Intel Mac OS X 10_15_7) AppleWebKit/605.1.15 (KHTML, like Gecko) Version/27.2 Safari/605.1.15"
  },
  "createdAt": "2026-10-01T00:07:13.675Z",
  "api": {
    "configRead": {
      "toneMapping": "extended",
      "format": "rgba16float",
      "colorSpace": "display-p3"
    },
    "gpu": true,
    "adapter": true,
    "device": true,
    "configure": true
  },
  "video": {
    "srcIsBlob": true,
    "videoHeight": 1920,
    "paused": false,
    "videoWidth": 3840
  }
}